{
 "$schema": "https://json-schema.org/draft/2020-12/schema",
 "$id": "tar:game",
 "type": "object",
 "required": [
  "title",
  "system"
 ],
 "properties": {
  "title": {
   "type": "string"
  },
  "system": {
   "type": "string"
  },
  "established": {
   "type": "boolean"
  },
  "tasvideosGameId": {
   "type": [
    "integer",
    "null"
   ]
  },
  "formerKeys": {
   "type": "array",
   "uniqueItems": true,
   "items": {
    "type": "string",
    "pattern": "^[a-z0-9-]+/[a-z0-9-]+$"
   },
   "description": "addresses (system/slug) this game had before it moved; each keeps a page that forwards here"
  },
  "ratifiedBy": {
   "type": "string",
   "description": "the expert who ratified this game, if one did"
  },
  "ratifiedAt": {
   "type": "string",
   "pattern": "^\\d{4}-\\d{2}-\\d{2}$"
  },
  "rejected": {
   "type": "object",
   "required": [
    "by",
    "date",
    "reason"
   ],
   "additionalProperties": false,
   "description": "an expert refused this as not a real, distinct thing",
   "properties": {
    "by": {
     "type": "string"
    },
    "date": {
     "type": "string",
     "pattern": "^\\d{4}-\\d{2}-\\d{2}$"
    },
    "reason": {
     "type": "string",
     "minLength": 8,
     "maxLength": 500
    },
    "at": {
     "type": "string",
     "pattern": "^\\d{4}-\\d{2}-\\d{2}T\\d{2}:\\d{2}:\\d{2}Z$",
     "description": "arrival moment, seconds, UTC; date stays the day people read"
    }
   }
  },
  "removalRequests": {
   "type": "array",
   "description": "removal requests, newest last; at most one open",
   "items": {
    "type": "object",
    "required": [
     "by",
     "date",
     "reason",
     "status"
    ],
    "additionalProperties": false,
    "properties": {
     "by": {
      "type": "string"
     },
     "date": {
      "type": "string",
      "pattern": "^\\d{4}-\\d{2}-\\d{2}$"
     },
     "reason": {
      "type": "string",
      "minLength": 8,
      "maxLength": 500
     },
     "status": {
      "enum": [
       "open",
       "granted",
       "declined"
      ]
     },
     "decidedBy": {
      "type": "string"
     },
     "decidedAt": {
      "type": "string",
      "pattern": "^\\d{4}-\\d{2}-\\d{2}$"
     },
     "note": {
      "type": "string",
      "maxLength": 500
     },
     "at": {
      "type": "string",
      "pattern": "^\\d{4}-\\d{2}-\\d{2}T\\d{2}:\\d{2}:\\d{2}Z$",
      "description": "arrival moment, seconds, UTC; date stays the day people read"
     }
    }
   }
  },
  "removed": {
   "type": "object",
   "required": [
    "by",
    "date",
    "reason"
   ],
   "additionalProperties": false,
   "description": "a granted removal: out of the index, page kept",
   "properties": {
    "by": {
     "type": "string"
    },
    "date": {
     "type": "string",
     "pattern": "^\\d{4}-\\d{2}-\\d{2}$"
    },
    "reason": {
     "type": "string",
     "maxLength": 500
    },
    "requestedBy": {
     "type": "string"
    },
    "at": {
     "type": "string",
     "pattern": "^\\d{4}-\\d{2}-\\d{2}T\\d{2}:\\d{2}:\\d{2}Z$",
     "description": "arrival moment, seconds, UTC; date stays the day people read"
    }
   }
  },
  "forum": {
   "type": "object",
   "required": [
    "topicId"
   ],
   "description": "the game's anchor topic; its tag page is the game's forum home",
   "properties": {
    "topicId": {
     "type": "integer",
     "minimum": 1
    },
    "url": {
     "type": "string",
     "pattern": "^https?://"
    }
   }
  },
  "thumbnail": {
   "type": "string",
   "pattern": "^thumb\\.(png|jpg|webp)$",
   "description": "an expert-set face for the game's page and card"
  },
  "ratifiedAtTime": {
   "type": "string",
   "pattern": "^\\d{4}-\\d{2}-\\d{2}T\\d{2}:\\d{2}:\\d{2}Z$",
   "description": "arrival moment, seconds, UTC; date stays the day people read"
  },
  "released": {
   "type": "string",
   "pattern": "^\\d{4}(-\\d{2}(-\\d{2})?)?$",
   "description": "first public release: YYYY, YYYY-MM or YYYY-MM-DD"
  },
  "unofficial": {
   "type": "boolean",
   "description": "a ROM hack, mod, fangame or other unofficial release"
  },
  "discord": {
   "type": "string",
   "pattern": "^https://(discord\\.gg|discord\\.com/invite)/[A-Za-z0-9-]+$",
   "description": "the game's community Discord, a permanent invite"
  },
  "website": {
   "type": "string",
   "pattern": "^https?://\\S+$",
   "description": "the community hub, wiki or leaderboard for this game"
  },
  "rta": {
   "type": "string",
   "pattern": "^https?://\\S+$",
   "description": "where the RTA (real-time) records for this game live"
  },
  "rules": {
   "type": "string",
   "minLength": 1,
   "maxLength": 2000,
   "description": "game-wide rules, markdown; shown above every category's own rule"
  }
 }
}
