{
 "title": "Prince of Persia: The Sands of Time",
 "system": "gc",
 "tasvideosGameId": 3583,
 "forum": {
  "topicId": 879,
  "url": "https://forum.toolassisted.run/t/879"
 },
 "thumbnail": "thumb.png",
 "released": "2003-10-28",
 "rta": "https://www.speedrun.com/pop_sot",
 "website": "https://popruns.github.io/",
 "discord": "https://discord.com/invite/0Ss0agDWPoiSvr3E"
}
