{
 "title": "The Hobbit",
 "system": "zxs",
 "tasvideosGameId": 4777,
 "forum": {
  "topicId": 1226,
  "url": "https://forum.toolassisted.run/t/1226"
 },
 "released": "1982",
 "discord": "https://discord.gg/urMJXue",
 "website": "https://www.lysator.liu.se/tolkien-games/entry/hobbit.html",
 "rta": "https://www.speedrun.com/hobbitsa",
 "thumbnail": "thumb.jpg"
}
