{
 "title": "Best of the Best: Championship Karate",
 "system": "genesis",
 "tasvideosGameId": 4781,
 "forum": {
  "topicId": 886,
  "url": "https://forum.toolassisted.run/t/886"
 },
 "rta": "https://www.speedrun.com/best_of_the_best_championship_karate?h=Win-genesis&x=xk99q64k-kn0ky0o8.1w4552mq"
}
