{
 "title": "Bishoujo Senshi Sailor Moon S: Jougai Rantou!? Shuyaku Soudatsusen",
 "system": "snes",
 "tasvideosGameId": 4631,
 "forum": {
  "topicId": 977,
  "url": "https://forum.toolassisted.run/t/977"
 },
 "rta": "https://www.speedrun.com/bishoujo_senshi_sailor_moon_s",
 "discord": "https://discord.gg/YtMMvcB5Su"
}
