{
 "title": "Mario Paint",
 "system": "snes",
 "tasvideosGameId": 2496,
 "forum": {
  "topicId": 1399,
  "url": "https://forum.toolassisted.run/t/1399"
 },
 "thumbnail": "thumb.jpg",
 "released": "1992-07-14",
 "discord": "https://discord.gg/9pgnp7Y8Tn",
 "website": "https://www.mariowiki.com/Mario_Paint",
 "rta": "https://www.speedrun.com/mariopaint"
}
